1_Maccabees,12,1,約納堂見時局為自己有利就挑選幾個人，打發他們往羅馬去，與羅馬人重修舊好。
1_Maccabees,12,2,為了這事，也給斯巴達人及其他地方寫了信。
1_Maccabees,12,3,使者到了羅馬，進了元老院，說道：「大司祭約納堂和猶太人民，打發我們來，請你們與他們重修友好盟約，如同從前一樣。」
1_Maccabees,12,4,元老們就交給他們一封給各地官吏的公函，以便護送他們平安回到猶太地方。
1_Maccabees,12,5,約納堂寫給斯巴達人的信，原文如下：
1_Maccabees,12,6,「大司祭約納堂，民間長老、司祭及猶太其餘民眾，祝斯巴達弟兄安好！
1_Maccabees,12,7,從前管轄你們的君王阿勒烏，致書大司祭敖尼雅時，曾稱你們是我們的弟兄，正如所附副本指出的一樣。
1_Maccabees,12,8,敖尼雅曾優待了被打發來的使者，也接受了談及聯盟與友好的信件。
1_Maccabees,12,9,我們雖然不需要這些事，因為有我們手中的聖經作安慰；
1_Maccabees,12,10,但是，我們仍願試驗一下，遣發使者到你們那裏去，為與你們重建弟兄和朋友之誼，不致與你們疏遠，因為自從收到你們的來信後，到現在時間已經過了很久。
1_Maccabees,12,11,所以我們在節日，及其他法定日子，當獻祭和祈禱時，時常不斷記念你們；原來記念自己的弟兄，本是理所當然的。
1_Maccabees,12,12,我們也為了你們的榮耀而喜樂。
1_Maccabees,12,13,至於我們，當種種困難、連年戰爭、四面楚歌、鄰國攻打我們的時候，
1_Maccabees,12,14,在這些戰爭中，我們不願意麻煩你們和我們其他的同盟及友邦，
1_Maccabees,12,15,因為我們有上天的助佑，來協助我們，拯救我們脫離敵人的手，使敵人屈服。
1_Maccabees,12,16,所以我們纔選派安提約古的兒子奴默尼，和雅松的兒子安提帕特，打發他們到羅馬人那裏去，與他們重立昔日的友好同盟。
1_Maccabees,12,17,我們也吩咐他們，到你們那裏去，向你們致敬，並且也把關於重建我們之間弟兄友誼的書信，呈給你們，
1_Maccabees,12,18,也請你們對這事給我們一個答覆。」
1_Maccabees,12,19,這是從前寄給敖尼雅的信的副本：
1_Maccabees,12,20,「斯巴達王阿勒烏，祝大司祭敖尼雅安好！
1_Maccabees,12,21,在論及斯巴達人和猶太人一文獻上發現：這兩個民族彼此是弟兄，因為他們都是亞巴郎的後裔。
1_Maccabees,12,22,現在我們既然知道這事，就請你們更好將你們的昇平情況，寫給我們，
1_Maccabees,12,23,我們也寫給你們：凡你們的牲畜和財產，都是我們的；凡我們的，也都是你們的；所以我們吩咐了使者，將這些事呈報給你們。」
1_Maccabees,12,24,約納堂聽說：德默特琉的將領，帶着比以前更多的軍隊回來，要與他作戰，
1_Maccabees,12,25,就離開耶路撒冷，往哈瑪特地方去迎擊敵人，因為他不肯讓他們有侵入自己邊境的時間。
1_Maccabees,12,26,並且打發偵探到敵方軍營裏去，他們回來給他報告說：敵人決議要在夜間進襲。
1_Maccabees,12,27,太陽西落時，約納堂吩咐部下戒備，整夜攜帶武器，準備作戰，並在軍營四周，派上哨兵。
1_Maccabees,12,28,敵人聽說約納堂和部下都準備決戰，怕得膽戰心驚，便在自己營中點起火，逃走了。
1_Maccabees,12,29,約納堂和他的部下，先只看見火光，直到早晨纔知道敵人已經逃走。
1_Maccabees,12,30,約納堂就去追趕他們，但沒有追上，因為他們早已渡過厄婁特洛河。
1_Maccabees,12,31,約納堂轉而攻擊稱為匝巴泰的阿剌伯人，將他們打敗，搶掠了他們的財物。
1_Maccabees,12,32,之後，便又出發，來到大馬士革，走遍全境。
1_Maccabees,12,33,同時，息孟也出征，直到阿市刻隆和臨近的堡壘，然後轉向約培，佔據了那城。
1_Maccabees,12,34,因為聽說，有人願將此堡壘交給德默特琉的黨羽，遂在那裏派軍隊把守。
1_Maccabees,12,35,約納堂回來之後，召集民間長老，與他們議決，要在猶太修建一些堡壘，
1_Maccabees,12,36,加高耶路撒冷的圍牆，在堡壘與城之間，修築一堵高牆，將堡壘與城分開，使堡壘孤立，叫其中的人不能買賣。
1_Maccabees,12,37,猶太人便聚集起來修城，因為溪旁的東牆，已經倒塌；也把稱為加斐納達的地區加以重修。
1_Maccabees,12,38,那時，息孟在舍斐拉也重修了哈狄得，加以設防，還安上門和閂。
1_Maccabees,12,39,那時，特黎豐企圖作亞細亞王，自戴王冠，而向安提約古下手，
1_Maccabees,12,40,卻怕約納堂不容許他如此作，反而來攻打他，便設計擒拿約納堂，將他殺死；遂起程來到貝特商。
1_Maccabees,12,41,約納堂帶着四萬作戰精兵出發，也來到貝特商，與他交戰。
1_Maccabees,12,42,特黎豐見約納堂帶着大軍前來，不敢向他下手；
1_Maccabees,12,43,便以禮接待他，將他推薦給自己的眾朋友，送給他禮物，還命自己的朋友和自己的軍隊，都要服從他，如同服從自己一樣，
1_Maccabees,12,44,然後對約納堂說：「我們之間，既無戰事，你為什麼煩勞這麼多的人呢？
1_Maccabees,12,45,現在你打發他們各回本家罷！為你自己只選少數的人跟隨你，同我一起往仆托肋買去，我要將這座城，及其他堡壘、軍隊和一切官吏、都交給你；然後我回去，因為我原是為這事而來的。」
1_Maccabees,12,46,約納堂相信了他，就按他的話作了，遣散了軍隊，讓他們回到猶太地，
1_Maccabees,12,47,只為自己留下三千人，其中兩千人留在加里肋亞，與他同行的只有一千人。
1_Maccabees,12,48,約納堂一進仆托肋買城，仆托肋買人便關了城門，將他捉住，用刀將他同來的眾人都殺了。
1_Maccabees,12,49,同時，特黎豐又派步兵和騎兵，前往加里肋亞和大平原，去消滅約納堂的一切黨羽。
1_Maccabees,12,50,這些人雖已知道約納堂和跟從他的人，都被逮捕殺害，但仍然彼此鼓勵，整隊而出，準備決一死戰。
1_Maccabees,12,51,追趕他們的敵人，一見猶太人決意要為保全性命而戰，就折回去了。
1_Maccabees,12,52,這些人因此纔平安回到猶太地，他們都哀悼約納堂和跟從他的人，同時也非常恐懼；全以色列也都表示哀痛。
1_Maccabees,12,53,那時，他們四鄰所有的異民，都想滅絕猶太人說：「他們既沒有領袖，又沒有人幫助，現在我們應該去攻打他們，將他們的遺蹟由人間除去。」
