2_Chronicles,27,1,约堂登极时年二十五岁，在耶路撒冷作王凡十六年；他的母亲名叫耶鲁沙，是匝克多的女儿。
2_Chronicles,27,2,约堂行了上主视为正义的事，完全像他父亲所作的一样，只是没有进入上主的圣所；但百姓仍然败坏。
2_Chronicles,27,3,他建筑了上主殿宇的上门，在敖斐耳城墻上，也作了许多工程，
2_Chronicles,27,4,在犹大山地建筑了一些城池，在丛林中也建了一些营寨和堡垒。
2_Chronicles,27,5,约堂与阿孟子民的君王交战，战胜了他们，因此阿孟子民那一年给他进贡：银子一百『塔冷通』，小麦一万『苛尔』，大麦一万『苛尔』。以后第二第三年，阿孟子民仍进了这些贡物。
2_Chronicles,27,6,约堂因为在上主他的天主前，时常履行正道，所以日渐强盛。
2_Chronicles,27,7,约堂其馀的事迹，以及他的战绩和作为，都记载在以色列和犹大列王实录上。
2_Chronicles,27,8,他即位时年二十五岁，在耶路撒冷作王十六年。
2_Chronicles,27,9,约堂与祖先同眠，葬在达味城；他的儿子阿哈次继位为王。
